{
  "apiVersion": "aok/v1alpha1",
  "kind": "HostTaskBinding",
  "metadata": {
    "id": "host-task-binding",
    "name": "host-task-binding",
    "version": "0.1.0",
    "description": "Offline contract fixture."
  },
  "workItemRef": {
    "kind": "WorkItemBinding",
    "id": "issue-42-binding",
    "version": "0.1.0"
  },
  "assignmentRef": {
    "kind": "AgentAssignment",
    "id": "worker-assignment",
    "version": "0.1.0"
  },
  "host": "codex",
  "hostVersion": "1",
  "sessionId": "session-1",
  "attemptId": "attempt-1",
  "assignmentSha256": "bbbbbbbbbbbbbbbbbbbbbbbbbbbbbbbbbbbbbbbbbbbbbbbbbbbbbbbbbbbbbbbb"
}
